<?xml version="1.0" encoding="UTF-8"?>

<xs:schema xmlns:xs="http://www.w3.org/2001/XMLSchema">

    <xs:element name="courses">
        <xs:complexType>
            <xs:sequence>

                <xs:element name="course" maxOccurs="unbounded">
                    <xs:complexType>
                        <xs:sequence>

                            <xs:element name="title" type="xs:string"/>
                            <xs:element name="description" type="xs:string"/>

                            <!-- Optional instructor -->
                            <xs:element name="instructor" type="xs:string" minOccurs="0"/>

                            <xs:element name="topics">
                                <xs:complexType>
                                    <xs:sequence>
                                        <xs:element name="topic" type="xs:string" maxOccurs="unbounded"/>
                                    </xs:sequence>
                                </xs:complexType>
                            </xs:element>

                            <xs:element name="duration" type="xs:string"/>
                            <xs:element name="price" type="xs:decimal"/>

                        </xs:sequence>
                    </xs:complexType>
                </xs:element>

            </xs:sequence>
        </xs:complexType>
    </xs:element>

</xs:schema>